{
  "action_id": "ACT-workload-mixed-io",
  "audit_id": "AUD-20260629T120000Z-workload-mixed-io",
  "bpf_abi_version": "zigsched-bpf-abi-v1",
  "cleanup_proof_path": "evidence/lab/matrix-fixtures/workload-mixed-io/cleanup-proof.json",
  "evidence_mode": "vm-live",
  "git": {
    "actual_sha": "302cead",
    "dirty": false,
    "expected_sha": "302cead",
    "status": "current"
  },
  "host_mutation": false,
  "host_refusal_proof_path": "evidence/lab/matrix-fixtures/workload-mixed-io/host-refusal.json",
  "incident_path": "evidence/lab/matrix-fixtures/workload-mixed-io/incident.json",
  "kernel_tuple": {
    "arch": "x86_64",
    "btf": "present",
    "kernel_release": "6.12.0-lab",
    "kvm": "available",
    "sched_ext": "available"
  },
  "matrix_run_id": "MR-20260629-WORKLOAD",
  "outcome": "PASS",
  "policy": {
    "name": "zigsched_minimal",
    "object_path": "evidence/lab/matrix-fixtures/workload-mixed-io/policy.o",
    "object_sha256": "aaaaaaaaaaaaaaaaaaaaaaaaaaaaaaaaaaaaaaaaaaaaaaaaaaaaaaaaaaaaaaaa",
    "source_path": "bpf/zigsched_minimal.bpf.c",
    "source_sha256": "bbbbbbbbbbbbbbbbbbbbbbbbbbbbbbbbbbbbbbbbbbbbbbbbbbbbbbbbbbbbbbbb"
  },
  "post_cgroup_state": {
    "digest": "sha256:ddddddddddddddddddddddddddddddddddddddddddddddddddddddddddddddd5"
  },
  "post_scheduler_state": {
    "ops": "none",
    "sched_ext": "disabled"
  },
  "pre_cgroup_state": {
    "digest": "sha256:ddddddddddddddddddddddddddddddddddddddddddddddddddddddddddddddd5"
  },
  "pre_scheduler_state": {
    "ops": "none",
    "sched_ext": "disabled"
  },
  "privacy_scan": {
    "private_fields_found": false,
    "report_path": "evidence/lab/matrix-fixtures/workload-mixed-io/privacy-scan.json",
    "status": "PASS"
  },
  "release_eligible": false,
  "rollback_id": "RB-workload-mixed-io",
  "rollback_proof_path": "evidence/lab/matrix-fixtures/workload-mixed-io/rollback-proof.json",
  "runtime_sample_path": "evidence/lab/matrix-fixtures/workload-mixed-io/runtime-sample.jsonl",
  "scenario_id": "workload-mixed-io",
  "schema": "zig-scheduler/matrix-run/v1",
  "supported_tuple_status": "supported",
  "vm_marker": {
    "checked_by": "qa/vm/marker-check",
    "path": "/run/zig-scheduler-vm-lab.marker",
    "present": true,
    "required": true
  },
  "workload": {
    "name": "mixed-io",
    "spec_path": "fixtures/matrix-run/workload-specs/workload-mixed-io.json",
    "spec_sha256": "8a2165e7c98169035e6a9bb745a1b470611983d4ae7282c0f6babdbc03e1ffc2"
  }
}
